title,isbn,author,edition,genre,language,publisher,date_of_publication,prequel,damage
American Gods,9780062572110,Neil Gaiman,,Fantasy,English,William Morrow Paperbacks,"March 28, 2017",,A lil scuffed
Game Of Thrones,9780345536150,George R. R. Martin,,Fantasy,English,Bantam,"September 1, 2011",,
Game Of Thrones,9780345536150,George R. R. Martin,,Fantasy,English,Bantam,"September 1, 2011",,Coffee stained
Game Of Thrones,9780345536150,George R. R. Martin,,Fantasy,English,Bantam,"September 1, 2011",,abused to the point of being unreadable
Database Systems: The Complete Book,9780131873254,"H. Garcia-Molina, J. D. Ullman and J. Widom",Second Edition,Nonfiction,English,Pearson,2009-01-01,,Only emotional
And Then There Were None,9780312330873,Agatha Christie,,Mystery,English,St. Martin's Griffin,2004-05-04,,
University Physics with Modern Physics,9781292314730,"Hugh Young, Roger Freedman",Global edition,Sci-fi,English,Pearson,2019-10-04,,water damage